{
    "schema_version":  "0.2.0",
    "graph_id":  "greenfin-taxonomy-seed-v0.2",
    "snapshot_id":  "greenfin-taxonomy-seed-v0.2@2026-07-15",
    "as_of":  "2026-07-15T00:00:00+08:00",
    "domain":  "green_finance",
    "scope":  {
                  "themes":  [
                                 "ESG绿洗与融资成本"
                             ],
                  "languages":  [
                                    "zh",
                                    "en"
                                ],
                  "document_types":  [
                                         "project_spec"
                                     ],
                  "year_start":  null,
                  "year_end":  null
              },
    "build":  {
                  "created_at":  "2026-07-15T00:00:00+08:00",
                  "generator":  "D schema bootstrap",
                  "graph_schema_version":  "0.2.0",
                  "input_contract_versions":  [
                                                  "project-taxonomy/0.2.0"
                                              ],
                  "pipeline_run_id":  "run:taxonomy_seed_20260715",
                  "source_watermarks":  {
                                            "project_spec":  "2026-07-03"
                                        },
                  "base_graph_id":  null,
                  "parent_snapshot_id":  null,
                  "code_version":  null,
                  "config_hash":  null,
                  "notes":  "Engineering taxonomy only. This seed is not a literature-derived empirical result."
              },
    "nodes":  [
                  {
                      "id":  "topic:green_finance",
                      "type":  "topic",
                      "layer":  "knowledge",
                      "label":  "绿色金融",
                      "normalized_label":  "绿色金融",
                      "aliases":  [
                                      "green finance"
                                  ],
                      "description":  null,
                      "origin":  "curated",
                      "review_status":  "human_verified",
                      "confidence":  1,
                      "version":  1,
                      "validity":  {
                                       "observed_at":  "2026-07-15T00:00:00+08:00",
                                       "valid_from":  null,
                                       "valid_to":  null
                                   },
                      "source_profile_ids":  [

                                             ],
                      "evidence_ids":  [
                                           "ev:project_spec_graph_module"
                                       ],
                      "derivation":  null,
                      "properties":  {
                                         "seed_group":  "topic",
                                         "scientific_status":  "taxonomy_only"
                                     }
                  },
                  {
                      "id":  "topic:esg",
                      "type":  "topic",
                      "layer":  "knowledge",
                      "label":  "ESG",
                      "normalized_label":  "esg",
                      "aliases":  [
                                      "环境、社会与治理"
                                  ],
                      "description":  null,
                      "origin":  "curated",
                      "review_status":  "human_verified",
                      "confidence":  1,
                      "version":  1,
                      "validity":  {
                                       "observed_at":  "2026-07-15T00:00:00+08:00",
                                       "valid_from":  null,
                                       "valid_to":  null
                                   },
                      "source_profile_ids":  [

                                             ],
                      "evidence_ids":  [
                                           "ev:project_spec_graph_module"
                                       ],
                      "derivation":  null,
                      "properties":  {
                                         "seed_group":  "topic",
                                         "scientific_status":  "taxonomy_only"
                                     }
                  },
                  {
                      "id":  "topic:greenwashing",
                      "type":  "topic",
                      "layer":  "knowledge",
                      "label":  "绿洗",
                      "normalized_label":  "绿洗",
                      "aliases":  [
                                      "greenwashing",
                                      "漂绿"
                                  ],
                      "description":  null,
                      "origin":  "curated",
                      "review_status":  "human_verified",
                      "confidence":  1,
                      "version":  1,
                      "validity":  {
                                       "observed_at":  "2026-07-15T00:00:00+08:00",
                                       "valid_from":  null,
                                       "valid_to":  null
                                   },
                      "source_profile_ids":  [

                                             ],
                      "evidence_ids":  [
                                           "ev:project_spec_graph_module"
                                       ],
                      "derivation":  null,
                      "properties":  {
                                         "seed_group":  "topic",
                                         "scientific_status":  "taxonomy_only"
                                     }
                  },
                  {
                      "id":  "topic:green_credit",
                      "type":  "topic",
                      "layer":  "knowledge",
                      "label":  "绿色信贷",
                      "normalized_label":  "绿色信贷",
                      "aliases":  [
                                      "green credit"
                                  ],
                      "description":  null,
                      "origin":  "curated",
                      "review_status":  "human_verified",
                      "confidence":  1,
                      "version":  1,
                      "validity":  {
                                       "observed_at":  "2026-07-15T00:00:00+08:00",
                                       "valid_from":  null,
                                       "valid_to":  null
                                   },
                      "source_profile_ids":  [

                                             ],
                      "evidence_ids":  [
                                           "ev:project_spec_graph_module"
                                       ],
                      "derivation":  null,
                      "properties":  {
                                         "seed_group":  "topic",
                                         "scientific_status":  "taxonomy_only"
                                     }
                  },
                  {
                      "id":  "topic:green_bond",
                      "type":  "topic",
                      "layer":  "knowledge",
                      "label":  "绿色债券",
                      "normalized_label":  "绿色债券",
                      "aliases":  [
                                      "green bond"
                                  ],
                      "description":  null,
                      "origin":  "curated",
                      "review_status":  "human_verified",
                      "confidence":  1,
                      "version":  1,
                      "validity":  {
                                       "observed_at":  "2026-07-15T00:00:00+08:00",
                                       "valid_from":  null,
                                       "valid_to":  null
                                   },
                      "source_profile_ids":  [

                                             ],
                      "evidence_ids":  [
                                           "ev:project_spec_graph_module"
                                       ],
                      "derivation":  null,
                      "properties":  {
                                         "seed_group":  "topic",
                                         "scientific_status":  "taxonomy_only"
                                     }
                  },
                  {
                      "id":  "mechanism:information_asymmetry",
                      "type":  "mechanism",
                      "layer":  "knowledge",
                      "label":  "信息不对称",
                      "normalized_label":  "信息不对称",
                      "aliases":  [
                                      "information asymmetry"
                                  ],
                      "description":  null,
                      "origin":  "curated",
                      "review_status":  "human_verified",
                      "confidence":  1,
                      "version":  1,
                      "validity":  {
                                       "observed_at":  "2026-07-15T00:00:00+08:00",
                                       "valid_from":  null,
                                       "valid_to":  null
                                   },
                      "source_profile_ids":  [

                                             ],
                      "evidence_ids":  [
                                           "ev:project_spec_graph_module"
                                       ],
                      "derivation":  null,
                      "properties":  {